{
  "$schema": "https://json-schema.org/draft/2020-12/schema",
  "$id": "https://github.com/collocation-srs/schema/deck.schema.json",
  "title": "Колода карточек",
  "description": "Формат, который отдаёт пайплайн и читает приложение. Содержимое колоды иммутабельно: прогресс хранится отдельно и связывается по card.id.",
  "type": "object",
  "required": ["id", "name", "version", "language", "card_type", "built_at", "count", "chunks"],
  "additionalProperties": false,
  "properties": {
    "id": {
      "type": "string",
      "pattern": "^[a-z0-9-]+$",
      "description": "Идентификатор колоды, он же имя каталога."
    },
    "name": { "type": "string", "minLength": 1 },
    "description": { "type": "string" },
    "version": {
      "type": "string",
      "description": "Хэш содержимого. Меняется только когда меняются сами карточки, поэтому приложение по нему понимает, нужно ли обновляться."
    },
    "language": { "type": "string", "enum": ["en"] },
    "card_type": { "type": "string", "enum": ["cloze"] },
    "built_at": { "type": "string", "format": "date-time" },
    "source": {
      "type": "object",
      "properties": {
        "dict": { "type": "string" },
        "note": { "type": "string" }
      },
      "additionalProperties": true
    },
    "count": { "type": "integer", "minimum": 0 },
    "chunk_size": { "type": "integer", "minimum": 1 },
    "chunks": {
      "type": "array",
      "description": "Файлы с карточками, по порядку изучения. Разбиты на части ради ленивой загрузки в приложении.",
      "items": { "type": "string", "pattern": "^cards-[0-9]{3}\\.json$" }
    },
    "stats": { "type": "object", "additionalProperties": true }
  },
  "$defs": {
    "card": {
      "type": "object",
      "required": ["id", "type", "text", "answer", "accept", "hint", "phrase", "relation", "headword", "position"],
      "additionalProperties": false,
      "properties": {
        "id": {
          "type": "string",
          "pattern": "^c_[0-9a-f]{16}$",
          "description": "Стабильный идентификатор. Не зависит от примера, поэтому замена предложения не обнуляет прогресс."
        },
        "type": { "type": "string", "enum": ["cloze"] },
        "text": {
          "type": "string",
          "description": "Предложение с пропуском, обозначенным ___",
          "pattern": "___"
        },
        "answer": {
          "type": "string",
          "minLength": 1,
          "description": "Точная форма, стоявшая в предложении. Может быть словоизменённой: accept хранит словарные формы."
        },
        "accept": {
          "type": "array",
          "minItems": 1,
          "items": { "type": "string" },
          "description": "Словарные формы всех партнёров кластера. Все они считаются правильным ответом: это взаимозаменяемые варианты, и наказывать за любой из них нельзя."
        },
        "hint": {
          "type": "string",
          "description": "Первая буква и длина. Не украшение: без подсказки у 72% карточек есть три и более грамматически подходящих конкурента."
        },
        "translation": {
          "type": ["string", "null"],
          "description": "Перевод предложения целиком. Показывается на лицевой стороне: без него пропуск допускает много осмысленных вариантов, а с ним карточка становится упражнением на продукцию — смысл известен, нужно выдать английскую коллокацию."
        },
        "phrase": { "type": "string" },
        "relation": {
          "type": "string",
          "enum": ["adj+noun", "verb+obj", "noun+verb", "noun+noun", "adv+verb", "adv+adj", "verb+adj", "quant+noun", "adv+other", "prep", "phrase", "other"]
        },
        "headword": { "type": "string" },
        "sense": { "type": ["string", "null"] },
        "cefr": { "type": ["string", "null"], "enum": ["A1", "A2", "B1", "B2", "C1", "C2", null] },
        "band": { "type": "string", "enum": ["core", "common", "extended", "rare"] },
        "ambiguity": {
          "type": "string",
          "enum": ["low", "medium", "high"],
          "description": "Сколько чужих партнёров остаётся конкурентами после показа подсказки."
        },
        "flags": {
          "type": "array",
          "items": { "type": "string" },
          "description": "Замечания, не мешающие учить: длинное предложение, имя собственное."
        },
        "position": {
          "type": "integer",
          "minimum": 1,
          "description": "Место в общей очереди изучения."
        }
      }
    },
    "chunk": {
      "type": "array",
      "items": { "$ref": "#/$defs/card" }
    }
  }
}
