{
 "id": "en-collocations",
 "name": "Английские коллокации",
 "version": "6e40c6240982",
 "language": "en",
 "card_type": "cloze",
 "built_at": "2026-09-21T16:11:11+00:00",
 "source": {
  "dict": "ozdic",
  "note": "Словарные статьи ozdic (материал восходит к Oxford Collocations Dictionary); примеры и уровни — из данных того же сайта."
 },
 "count": 1008,
 "chunk_size": 250,
 "chunks": [
  "cards-000.json",
  "cards-001.json",
  "cards-002.json",
  "cards-003.json",
  "cards-004.json"
 ],
 "stats": {
  "relation": {
   "verb+obj": 224,
   "phrase": 125,
   "adv+verb": 39,
   "adj+noun": 229,
   "verb+adj": 36,
   "adv+adj": 37,
   "prep": 247,
   "noun+noun": 44,
   "noun+verb": 27
  },
  "band": {
   "core": 662,
   "common": 241,
   "extended": 75,
   "rare": 30
  },
  "cefr": {
   "None": 612,
   "A2": 173,
   "A1": 34,
   "B1": 148,
   "B2": 39,
   "C1": 2
  },
  "ambiguity": {
   "low": 673,
   "medium": 335
  }
 }
}